Product URL,Product Name,Product Price,Rating,Number of Reviews
https://www.amazon.in/Skybags-Brat-Black-Casual-Backpack/dp/B08Z1HHHTD/ref=mp_s_a_1_1?crid=2M096C61O4MLT&keywords=bags&qid=1692733874&sprefix=ba%2Caps%2C283&sr=8-1,Skybags Brat Black 46 Cms Casual Backpack,669,4.1,0
https://www.amazon.in/American-Tourister-AMT-SCH-02/dp/B07CJCGM1M/ref=mp_s_a_1_2?crid=2M096C61O4MLT&keywords=bags&qid=1692733874&sprefix=ba%2Caps%2C283&sr=8-2,American Tourister Fizz Large Size 32 Ltrs Casual Backpack (BLACK),"1,199",4.0,0
https://www.amazon.in/Half-Moon-Waterproof-Backpack-Students/dp/B085MHDJ93/ref=mp_s_a_1_3?crid=2M096C61O4MLT&keywords=bags&qid=1692733874&sprefix=ba%2Caps%2C283&sr=8-3,"Half Moon 35 Ltrs Water Resistant 15.6 inch Laptop Bag for Men/Backpack for Men, Navy Blue | Office Bag for Men/Office Bag for Women with Padded Laptop Compartment | Rain Cover & Reflective Strips",649,3.9,0
https://www.amazon.in/Rucksack-Travel-Backpack-Trekking-Compartment/dp/B07YDGQQN5/ref=mp_s_a_1_4?crid=2M096C61O4MLT&keywords=bags&qid=1692733874&sprefix=ba%2Caps%2C283&sr=8-4,"Fur Jaden 55 LTR Rucksack Travel Backpack Bag for Trekking, Hiking with Shoe Compartment",849,4.3,0
https://www.amazon.in/Number-Backpack-Compartment-Charging-Organizer/dp/B09VTDMRY7/ref=mp_s_a_1_5?crid=2M096C61O4MLT&keywords=bags&qid=1692733874&sprefix=ba%2Caps%2C283&sr=8-5,"FUR JADEN Anti Theft Number Lock Backpack Bag with 15.6 Inch Laptop Compartment, USB Charging Port & Organizer Pocket for Men Women Boys Girls",679,4.0,0
https://www.amazon.in/TRUE-HUMAN-Anti-Theft-backpack-charging/dp/B09QJ7ZF2Y/ref=mp_s_a_1_6?crid=2M096C61O4MLT&keywords=bags&qid=1692733874&sprefix=ba%2Caps%2C283&sr=8-6,TRUE HUMAN EMPEROR® Anti-Theft backpack With USB charging Port Laptop bag/Office bag/college bag/travel bag with anti -theft back pocket (LEGEND),599,3.7,0
https://www.amazon.in/FUR-JADEN-Leatherette-Polypropylene-DUFF05/dp/B07M9BRCQ5/ref=mp_s_a_1_7?crid=2M096C61O4MLT&keywords=bags&qid=1692733874&sprefix=ba%2Caps%2C283&sr=8-7,Fur Jaden Brown Textured Leatherette Stylish & Spacious Weekender Duffle Bag for Travel,899,4.3,0
https://www.amazon.in/Backpack-Small-Black-Water-Repellant/dp/B088XB5XY8/ref=mp_s_a_1_8?crid=2M096C61O4MLT&keywords=bags&qid=1692733874&sprefix=ba%2Caps%2C283&sr=8-8,"Mi Step Out 12 L Mini Backpack (Small Size, Black, Water Repellant)",249,4.1,0
https://www.amazon.in/Half-Moon-Backpack-Luggage-Compartment/dp/B09VCLZ3K4/ref=mp_s_a_1_9?crid=2M096C61O4MLT&keywords=bags&qid=1692733874&sprefix=ba%2Caps%2C283&sr=8-9,Half Moon Large 37L Laptop Bag Backpack for menं Women Boys and Girls Luggage Travel Bags with 17.3 inches Laptop Compartment & Rain Cover,849,3.9,0
https://www.amazon.in/GEAR-Black-Blue-Backpack-years/dp/B019HA8AYG/ref=mp_s_a_1_10?crid=2M096C61O4MLT&keywords=bags&qid=1692733874&sprefix=ba%2Caps%2C283&sr=8-10,Gear CarryOn 16L Foldable Water Resistant School Bag//Backpack/College Bag for Men/Women - Blue Black,199,3.7,0
https://www.amazon.in/Gear-Classic-Leather-Backpack-LBPCLSLTH0201/dp/B07G4F6XFH/ref=mp_s_a_1_11?crid=2M096C61O4MLT&keywords=bags&qid=1692733874&sprefix=ba%2Caps%2C283&sr=8-11,Gear Classic 20L Small Size Faux Leather Water Resistant Anti Theft Unisex Laptop Backpack- Brown,979,4.4,0
https://www.amazon.in/Wesley-Milestone-Waterproof-Backpack-Business/dp/B084JGJ8PF/ref=mp_s_a_1_12?crid=2M096C61O4MLT&keywords=bags&qid=1692733874&sprefix=ba%2Caps%2C283&sr=8-12,Wesley Milestone 2.0 Casual Waterproof Laptop Backpack/Office Bag/School Bag/College Bag/Business Bag/Travel Backpack (Dimensions:13x18 inches) (Compatible with 39.62cm(15.6inch laptop) 30 L (Blue & black),588,4.3,0
https://www.amazon.in/SFANE-Duffel-Shoulder-Women-Compartment/dp/B07XXFB9CZ/ref=mp_s_a_1_13?crid=2M096C61O4MLT&keywords=bags&qid=1692733874&sprefix=ba%2Caps%2C283&sr=8-13,Sfane Polyester 23cms Duffle/Shoulder/Gym Bag for Men & Women with Separate Shoe Compartment (Grey),387,4.3,0
https://www.amazon.in/Safari-Laptop-Backpack-Resistant-Fabric/dp/B09B25Z8M2/ref=mp_s_a_1_14?crid=2M096C61O4MLT&keywords=bags&qid=1692733874&sprefix=ba%2Caps%2C283&sr=8-14,Safari Quill Large Laptop Backpack 26 Ltrs Water Resistant Fabric - Black,859,3.9,0
https://www.amazon.in/Fur-Jaden-Black-Waterproof-Backpack/dp/B078GLXMDY/ref=mp_s_a_1_15?crid=2M096C61O4MLT&keywords=bags&qid=1692733921&sprefix=ba%2Caps%2C283&sr=8-15,FUR JADEN Anti Theft Backpack 15.6 Inch Laptop Bag with USB Charging Port For Men Women Boys Girls,839,4.0,0
https://www.amazon.in/ADISA-Laptop-Backpack-Office-College/dp/B09TPX22NF/ref=mp_s_a_1_16?crid=2M096C61O4MLT&keywords=bags&qid=1692733921&sprefix=ba%2Caps%2C283&sr=8-16,ADISA 15.6 inch laptop backpack office bag college travel back pack 32 Ltrs,499,3.9,0
https://www.amazon.in/Lenovo-15-6-Inches-Everyday-Backpack/dp/B08R7RPVJF/ref=mp_s_a_1_17?crid=2M096C61O4MLT&keywords=bags&qid=1692733921&sprefix=ba%2Caps%2C283&sr=8-17,"Lenovo 15.6"" (39.62cm) Slim Everyday Backpack, Made in India, Compact, Water-resistant, Organized storage:Laptop sleeve,tablet pocket,front workstation,2-side pockets,Padded adjustable shoulder straps",399,4.3,0
https://www.amazon.in/Zipline-Nexa-Resistant-Bagpack-Backpack/dp/B08WQ668WJ/ref=mp_s_a_1_18?crid=2M096C61O4MLT&keywords=bags&qid=1692733921&sprefix=ba%2Caps%2C283&sr=8-18,Zipline Unisex Casual Polyester 36 L Backpack School Bag Women Men Boys Girls Children Daypack College Bag Book School Sports Bag,843,3.6,0
https://www.amazon.in/ZIPLINE-Polyester-Backpack-Children-Daypack/dp/B07XVMR33Q/ref=mp_s_a_1_19?crid=2M096C61O4MLT&keywords=bags&qid=1692733921&sprefix=ba%2Caps%2C283&sr=8-19,Zipline Unisex casual polyester 36 L Backpack School Bag Women Men Boys Girls children Daypack College Bag Book School Sports Bag Weekend Bag,843,4.0,0
https://www.amazon.in/WILDHORN-Backpack-Compartment-Business-Stitching/dp/B09QL66G55/ref=mp_s_a_1_20?crid=2M096C61O4MLT&keywords=bags&qid=1692733921&sprefix=ba%2Caps%2C283&sr=8-20,"WILDHORN 31L Laptop Backpack for Men/Women I Fits upto 15.6"" Laptop I Waterproof I Travel/Business/College Bookbags",599,4.1,0
https://www.amazon.in/Lunars-V-Line-Resistant-Bagpack-College/dp/B08BP5CYDV/ref=mp_s_a_1_21?crid=2M096C61O4MLT&keywords=bags&qid=1692733921&sprefix=ba%2Caps%2C283&sr=8-21,"Lunar's V-Line Backpack for Men, Blue | 35L Water Resistant School Bags for Boys | Stylish, & Durable | College Bags for Men/College Bag for Girls | 1 Yr Warranty",735,4.1,0
https://www.amazon.in/Safari-Laptop-Backpack-Resistant-Fabric/dp/B09B28TKLG/ref=mp_s_a_1_22?crid=2M096C61O4MLT&keywords=bags&qid=1692733921&sprefix=ba%2Caps%2C283&sr=8-22,Safari Quill Large Laptop Backpack 26 Ltrs Water Resistant Fabric - Blue,859,4.0,0
https://www.amazon.in/Lavie-Sport-Duffle-Luggage-Trolley/dp/B097RJ22Q3/ref=mp_s_a_1_23?crid=2M096C61O4MLT&keywords=bags&qid=1692733921&sprefix=ba%2Caps%2C283&sr=8-23,Lavie Sport Lino Large Size 63 cms Wheel Duffle Bag for Travel | Travel Bag with Trolley,"1,049",4.0,0
https://www.amazon.in/ADISA-BP005-Weight-Casual-Backpack/dp/B07F3X45WZ/ref=mp_s_a_1_24?crid=2M096C61O4MLT&keywords=bags&qid=1692733921&sprefix=ba%2Caps%2C283&sr=8-24,ADISA Light Weight Laptop Backpack 32 Ltrs,499,4.0,0
https://www.amazon.in/Arctic-Fox-Liters-String-Backpack/dp/B08L6Q9V1H/ref=mp_s_a_1_25?crid=2M096C61O4MLT&keywords=bags&qid=1692733921&sprefix=ba%2Caps%2C283&sr=8-25,Arctic Fox 15 Liters Draw String Bag Lavender Backpack,209,4.2,0
https://www.amazon.in/Wesley-Spartan-Hiking-Raincover-Organiser/dp/B098QFF5TJ/ref=mp_s_a_1_26?crid=2M096C61O4MLT&keywords=bags&qid=1692733921&sprefix=ba%2Caps%2C283&sr=8-26,Wesley Spartan Unisex Travel Hiking Laptop Bag fits Upto 17.3 inch with Raincover and Internal Organiser Backpack Rucksack College Bag,749,4.1,0
https://www.amazon.in/Nivia-6853-Polyester-Basic-Duffle/dp/B07FWQ9HRV/ref=mp_s_a_1_27?crid=2M096C61O4MLT&keywords=bags&qid=1692733921&sprefix=ba%2Caps%2C283&sr=8-27,NIVIA Basic Duffle Polyester Bag/Gym Bags/Adjustable Shoulder Bag for Men/Duffle Gym Bags for Men/Fitness Bag/Carry Bags/Sports & Travel Bag/Sports Kit/Duffle Bags Travel,269,4.0,0
https://www.amazon.in/Genie-Flamenco2-Backpack-Compatible-Resistant/dp/B08YF9VHTY/ref=mp_s_a_1_28?crid=2M096C61O4MLT&keywords=bags&qid=1692733921&sprefix=ba%2Caps%2C283&sr=8-28,Genie Flamenco2 Casual Backpacks for Women,733,4.3,0
https://www.amazon.in/SAFARI-Ltrs-Casual-Backpack-DAYPACKNEO15CBSEB/dp/B07Q7CNPMV/ref=mp_s_a_1_29?crid=2M096C61O4MLT&keywords=bags&qid=1692733942&sprefix=ba%2Caps%2C283&sr=8-29,Safari Compact Size 15 Ltrs Casual Backpack For Unisex Adult - Sea Blue,329,4.0,0
https://www.amazon.in/AUXTER-BLACKY-Duffel-Emboss-Black/dp/B07F2H25NP/ref=mp_s_a_1_30?crid=2M096C61O4MLT&keywords=bags&qid=1692733942&sprefix=ba%2Caps%2C283&sr=8-30,AUXTER Faux Leather 23 Cms Duffle Bag(AUX_GB_LE_Black -SE__0521_Black),429,4.3,0
https://www.amazon.in/American-Tourister-BACKPACK-COMPARTMENT-ORGANIZER/dp/B0BTD4FK9G/ref=mp_s_a_1_31?crid=2M096C61O4MLT&keywords=bags&qid=1692733942&sprefix=ba%2Caps%2C283&sr=8-31,"American Tourister VALEX BLUE LAPTOP BACKPACK 28 Ltrs,Volume, LAPTOP COMPARTMENT, BOTTLE POCKET, FRONT ORGANIZER","1,399",4.2,0
https://www.amazon.in/ADISA-Laptop-Backpack-Office-College/dp/B0BPTV3795/ref=mp_s_a_1_32?crid=2M096C61O4MLT&keywords=bags&qid=1692733942&sprefix=ba%2Caps%2C283&sr=8-32,ADISA 32L large laptop backpack office bag college travel back pack with rain cover,599,3.9,0
https://www.amazon.in/ADISA-Casual-Backpack-College-BP046-NAV_Navy/dp/B0BX3QFVSM/ref=mp_s_a_1_33?crid=2M096C61O4MLT&keywords=bags&qid=1692733942&sprefix=ba%2Caps%2C283&sr=8-33,ADISA 31 Ltrs Casual Backpack School College Bag Pack,399,3.9,0
https://www.amazon.in/Zebronics-TechshieldA1-Compartment-15-6-inch-Polyester/dp/B0C6QV9GCY/ref=mp_s_a_1_34?crid=2M096C61O4MLT&keywords=bags&qid=1692733942&sprefix=ba%2Caps%2C283&sr=8-34,"Zebronics TechshieldA1, 18 Liters, 1 Compartment Laptop Backpack and Front Pocket, fit Up to 15.6-inch Laptop, Polyester Fabric, Office Use and Mini Business Travel Bags (Light Grey)",599,5.0,0
https://www.amazon.in/Gear-Black-Laptop-Backpack-LBPASPIRE0104/dp/B075MK4TXP/ref=mp_s_a_1_35?crid=2M096C61O4MLT&keywords=bags&qid=1692733942&sprefix=ba%2Caps%2C283&sr=8-35,Gear Aspire 30L Water Restant Office Laptop Bag/Backpack for Men/Women/(Black),"1,115",4.3,0
https://www.amazon.in/American-Tourister-BACKPACK-COMPARTMENT-ORGANIZER/dp/B0BTD4S4XF/ref=mp_s_a_1_36?crid=2M096C61O4MLT&keywords=bags&qid=1692733942&sprefix=ba%2Caps%2C283&sr=8-36,"American Tourister VALEX BLACK LAPTOP BACKPACK 28 Ltrs,Volume, LAPTOP COMPARTMENT, BOTTLE POCKET, FRONT ORGANIZER","1,399",4.3,0
https://www.amazon.in/Nivia-5183-Polyester-Duffle-Medium/dp/B071KNXQ7Y/ref=mp_s_a_1_37?crid=2M096C61O4MLT&keywords=bags&qid=1692733942&sprefix=ba%2Caps%2C283&sr=8-37,NIVIA Beast Gym Bag-4 Polyester/Unisex Gym Bags/Shoulder Bag for Men & Women with Separate Shoes Compartment/Carry Gym Accessories/Fitness Bag/Sports & Travel Bag/Sports Kit,499,4.2,0
https://www.amazon.in/Half-Moon-Backpack-Spacious-Multiple/dp/B0C23Z9W18/ref=mp_s_a_1_38?crid=2M096C61O4MLT&keywords=bags&qid=1692733942&sprefix=ba%2Caps%2C283&sr=8-38,Half Moon Aztec 37L School Bag Class 5-12 | College Bagpack for Men/College Back pack for Women | 15.6 inch Laptop Bag for Men/Backpack for Men | Spacious & Multiple Pockets,649,3.6,0
https://www.amazon.in/Genie-Miami-litres-Casual-Backpack/dp/B07SRGGGNC/ref=mp_s_a_1_39?crid=2M096C61O4MLT&keywords=bags&qid=1692733942&sprefix=ba%2Caps%2C283&sr=8-39,"Genie Miami Laptop Backpack for Women,Tuition bag, 16 inches Office Bag, Sky Blue Stylish and Trendy Bag for Office and College",803,4.2,0
https://www.amazon.in/Wesley-Milestone-Waterproof-Backpack-Business/dp/B085S444JV/ref=mp_s_a_1_40?crid=2M096C61O4MLT&keywords=bags&qid=1692733942&sprefix=ba%2Caps%2C283&sr=8-40,"Wesley Milestone 2.0 Casual Waterproof Laptop Backpack/Office Bag/School Bag/College Bag/Business Bag/Travel Backpack (Dimensions:13x18 inches) (Compatible with 39.62cm(15.6inch laptop) 30 L, Charcoal black",588,4.3,0
https://www.amazon.in/LOOKMUSTER-Waterproof-Backpack-College-Business/dp/B0BS6YGKMC/ref=mp_s_a_1_41?crid=2M096C61O4MLT&keywords=bags&qid=1692733942&sprefix=ba%2Caps%2C283&sr=8-41,LOOKMUSTER Casual Waterproof Laptop Backpack/Office Bag/School Bag/College Bag/Business Bag/Travel Backpack…,613,3.9,0
https://www.amazon.in/AmazonBasics-Mini-Backpack-Outdoor-Black/dp/B0BRKFXT9Z/ref=mp_s_a_1_42?crid=2M096C61O4MLT&keywords=bags&qid=1692733942&sprefix=ba%2Caps%2C283&sr=8-42,AmazonBasics - Mini Backpack for Outdoor Use (12 l) (Black),279,3.7,0
https://www.amazon.in/LOOKMUSTER-Waterproof-Backpack-College-Business/dp/B0BS6YGKMC/ref=mp_s_a_1_43?crid=2M096C61O4MLT&keywords=bags&qid=1692733959&sprefix=ba%2Caps%2C283&sr=8-43,LOOKMUSTER Casual Waterproof Laptop Backpack/Office Bag/School Bag/College Bag/Business Bag/Travel Backpack…,613,3.9,0
https://www.amazon.in/TRUE-Emperor-Anti-Theft-backpack-charging/dp/B0BYB631NR/ref=mp_s_a_1_44?crid=2M096C61O4MLT&keywords=bags&qid=1692733959&sprefix=ba%2Caps%2C283&sr=8-44,"TRUE HUMAN® Emperor Anti-Theft Pocket backpack With USB charging Port Laptop,office,college,travel bag for men and women(Epower)",599,3.6,0
https://www.amazon.in/Lavie-Sport-Duffle-Luggage-Trolley/dp/B097RJ22Q3/ref=mp_s_a_1_45?crid=2M096C61O4MLT&keywords=bags&qid=1692733959&sprefix=ba%2Caps%2C283&sr=8-45,Lavie Sport Lino Large Size 63 cms Wheel Duffle Bag for Travel | Travel Bag with Trolley,"1,049",4.0,0
https://www.amazon.in/Zipline-Nexa-Resistant-Bagpack-Backpack/dp/B08WQ668WJ/ref=mp_s_a_1_46?crid=2M096C61O4MLT&keywords=bags&qid=1692733959&sprefix=ba%2Caps%2C283&sr=8-46,Zipline Unisex Casual Polyester 36 L Backpack School Bag Women Men Boys Girls Children Daypack College Bag Book School Sports Bag,843,3.6,0
https://www.amazon.in/Safari-Spartan-Water-Resistant-Backpack/dp/B09B26MB5M/ref=mp_s_a_1_47?crid=2M096C61O4MLT&keywords=bags&qid=1692733959&sprefix=ba%2Caps%2C283&sr=8-47,"Safari Spartan 21 Ltrs Water Resistant Backpack - Blue, S (SPARTAN19CBBLU)",609,3.8,0
https://www.amazon.in/Step-Backpack-Small-Water-Repellant/dp/B088XG77KN/ref=mp_s_a_1_48?crid=2M096C61O4MLT&keywords=bags&qid=1692733959&sprefix=ba%2Caps%2C283&sr=8-48,"Mi Step Out 12 L Mini Backpack (Small Size, Red, Water Repellant)",398,4.1,0
https://www.amazon.in/Motherly-Stylish-Babies-Diaper-Mothers/dp/B07DMKJJB4/ref=mp_s_a_1_49?crid=2M096C61O4MLT&keywords=bags&qid=1692733959&sprefix=ba%2Caps%2C283&sr=8-49,motherly Stylish Babies Diaper Bags for Mothers - Economical Version (Grey and Pink),"1,799",4.6,0
https://www.amazon.in/Uppercase-Professional-Backpack-Resistant-Sustainable/dp/B0BWNBQXDZ/ref=mp_s_a_1_50?crid=2M096C61O4MLT&keywords=bags&qid=1692733959&sprefix=ba%2Caps%2C283&sr=8-50,"uppercase Apex Professional Laptop Backpack (15.6 Inch) 3x more water resistant sustainable bags with rain proof zippers for Men, Women, Boys and Girls, 750 Days warranty","1,800",4.4,0
https://www.amazon.in/Fur-Jaden-Charging-Waterproof-BM36_BlueZip/dp/B07MXM5M99/ref=mp_s_a_1_51?crid=2M096C61O4MLT&keywords=bags&qid=1692733959&sprefix=ba%2Caps%2C283&sr=8-51,"Fur Jaden 15.6 Inch Laptop Backpack 25 LTR Bag for School, College and Office with USB Charging Port",479,3.9,0
https://www.amazon.in/Genie-Miami-litres-Casual-Backpack/dp/B07SRGGGNC/ref=mp_s_a_1_52?crid=2M096C61O4MLT&keywords=bags&qid=1692733959&sprefix=ba%2Caps%2C283&sr=8-52,"Genie Miami Laptop Backpack for Women,Tuition bag, 16 inches Office Bag, Sky Blue Stylish and Trendy Bag for Office and College",803,4.2,0
https://www.amazon.in/Safari-Spartan-Water-Resistant-Backpack/dp/B09B277CR5/ref=mp_s_a_1_53?crid=2M096C61O4MLT&keywords=bags&qid=1692733959&sprefix=ba%2Caps%2C283&sr=8-53,"Safari Spartan 21 Ltrs Water Resistant Backpack - Teal, S (SPARTAN19CBTEA)",609,3.8,0
https://www.amazon.in/ZIPLINE-Polyester-Backpack-Children-Daypack/dp/B07XVMR33Q/ref=mp_s_a_1_54?crid=2M096C61O4MLT&keywords=bags&qid=1692733959&sprefix=ba%2Caps%2C283&sr=8-54,Zipline Unisex casual polyester 36 L Backpack School Bag Women Men Boys Girls children Daypack College Bag Book School Sports Bag Weekend Bag,843,4.0,0
https://www.amazon.in/Half-Moon-Backpack-Spacious-Multiple/dp/B0C23Z9W18/ref=mp_s_a_1_55?crid=2M096C61O4MLT&keywords=bags&qid=1692733959&sprefix=ba%2Caps%2C283&sr=8-55,Half Moon Aztec 37L School Bag Class 5-12 | College Bagpack for Men/College Back pack for Women | 15.6 inch Laptop Bag for Men/Backpack for Men | Spacious & Multiple Pockets,649,3.6,0
https://www.amazon.in/DZert-Panda-School-Backpacks-Cartoon/dp/B07WSBV3BN/ref=mp_s_a_1_56?crid=2M096C61O4MLT&keywords=bags&qid=1692733959&sprefix=ba%2Caps%2C283&sr=8-56,DZert Kids School Bag Soft Plush Backpacks Cartoon Boys Girls Baby (2-5 Years),249,3.7,0
https://www.amazon.in/Tabelito%C2%AE-Basic-Laptop-Sleeve-Surfacepro/dp/B09NDTW8SP/ref=mp_s_a_1_57?crid=2M096C61O4MLT&keywords=bags&qid=1692733982&sprefix=ba%2Caps%2C283&sr=8-57,Tabelito® Basic Laptop Bag Laptop Cover Laptop Bags Laptop Sleeve Office Bag Laptop Bag 15.6 inch(39.6cm) Laptop Apple/Lenovo/Asus/Hp/MacBook/Thinkpad/Ideapad (Grey),299,4.1,0
https://www.amazon.in/NORTH-ZONE-Lightweight-Backpacks-Stylish/dp/B0BL3S5NC1/ref=mp_s_a_1_58?crid=2M096C61O4MLT&keywords=bags&qid=1692733982&sprefix=ba%2Caps%2C283&sr=8-58,NORTH ZONE Lightweight school bags Backpacks for Boys Girls Stylish men and women Casual Travel Laptop Bag College office,630,4.0,0
https://www.amazon.in/AirCase-C34-Laptop-Backpack-Women/dp/B07QL8633G/ref=mp_s_a_1_59?crid=2M096C61O4MLT&keywords=bags&qid=1692733982&sprefix=ba%2Caps%2C283&sr=8-59,"AirCase Laptop Bag Backpack Case Pouch for Laptop Backpack for Men & Women,Premium Vegan Leather",929,3.9,0
https://www.amazon.in/Lunars-Bingo-Laptop-Resistant-48L/dp/B08YZ5XY31/ref=mp_s_a_1_60?crid=2M096C61O4MLT&keywords=bags&qid=1692733982&sprefix=ba%2Caps%2C283&sr=8-60,Lunar's Bingo - 48 L Laptop Office/School/Travel/Business Backpack Water Resistant - Fits Up to 15.6 Inch Laptop Notebook with 1 Year Warranty,819,3.9,0
https://www.amazon.in/NORTH-ZONE-Northzone-Business-Messenger/dp/B0C555LQF4/ref=mp_s_a_1_61?crid=2M096C61O4MLT&keywords=bags&qid=1692733982&sprefix=ba%2Caps%2C283&sr=8-61,NORTH ZONE Northzone Sling Cross Body Travel Office Business Messenger One Side Shoulder Pouch Bag Money Bag for Men and Women,249,3.8,0
https://www.amazon.in/ADISA-BP010-Weight-Casual-Backpack/dp/B07MXL986B/ref=mp_s_a_1_62?crid=2M096C61O4MLT&keywords=bags&qid=1692733982&sprefix=ba%2Caps%2C283&sr=8-62,ADISA 32 Ltrs Water Resistant Casual Travel Bagpack/College Backpack/School Office Bag for Men and Women,499,3.9,0
https://www.amazon.in/Genie-Miami-litres-Casual-Backpack/dp/B07SRGGGNC/ref=mp_s_a_1_63?crid=2M096C61O4MLT&keywords=bags&qid=1692733982&sprefix=ba%2Caps%2C283&sr=8-63,"Genie Miami Laptop Backpack for Women,Tuition bag, 16 inches Office Bag, Sky Blue Stylish and Trendy Bag for Office and College",803,4.2,0
https://www.amazon.in/Waterproof-Backpack-Students-adjustable-Compartment/dp/B09V5HRYR7/ref=mp_s_a_1_64?crid=2M096C61O4MLT&keywords=bags&qid=1692733982&sprefix=ba%2Caps%2C283&sr=8-64,CAPRIFF 32 L Casual Waterproof Laptop Bag/Backpack for Men Boys & Girls For Office School College Teens & Students with Rain Cover With adjustable Strap With 2 Compartment,699,3.8,0
https://www.amazon.in/Nivia-6853-Polyester-Basic-Duffle/dp/B07FWQ9HRV/ref=mp_s_a_1_65?crid=2M096C61O4MLT&keywords=bags&qid=1692733982&sprefix=ba%2Caps%2C283&sr=8-65,NIVIA Basic Duffle Polyester Bag/Gym Bags/Adjustable Shoulder Bag for Men/Duffle Gym Bags for Men/Fitness Bag/Carry Bags/Sports & Travel Bag/Sports Kit/Duffle Bags Travel,269,4.0,0
https://www.amazon.in/Police-Polyester-laptop-casual-backpack/dp/B09CQ5T3LN/ref=mp_s_a_1_66?crid=2M096C61O4MLT&keywords=bags&qid=1692733982&sprefix=ba%2Caps%2C283&sr=8-66,POLICE Backpack for Men Casual Laptop Bag Office/Travel/College 30 Ltr Hedge Polyester - Black,"1,399",4.1,0
https://www.amazon.in/AUXTER-BLACKY-Duffel-Emboss-Black/dp/B07F2H25NP/ref=mp_s_a_1_67?crid=2M096C61O4MLT&keywords=bags&qid=1692733982&sprefix=ba%2Caps%2C283&sr=8-67,AUXTER Faux Leather 23 Cms Duffle Bag(AUX_GB_LE_Black -SE__0521_Black),429,4.3,0
https://www.amazon.in/ADISA-Womens-Girls-Party-Crossbody/dp/B0B2WBJ2H8/ref=mp_s_a_1_68?crid=2M096C61O4MLT&keywords=bags&qid=1692733982&sprefix=ba%2Caps%2C283&sr=8-68,ADISA Women's Girls Party Sling Bag Crossbody,394,4.0,0
https://www.amazon.in/Waterproof-Backpack-College-Business-Dimensions/dp/B0BW95MXRJ/ref=mp_s_a_1_69?crid=2M096C61O4MLT&keywords=bags&qid=1692733982&sprefix=ba%2Caps%2C283&sr=8-69,NORTH ZONE Casual Waterproof Laptop Backpack/Office Bag/School Bag/College Bag/Business Bag/Travel Backpack (Dimensions:13x18 inches) (Compatible with 39.62cm(15.6inch laptop) 30 L (Blue & black),486,4.6,0
https://www.amazon.in/TAGUDA-foldable-portable-lightweight-organizer/dp/B0B8CSC4F1/ref=mp_s_a_1_70?crid=2M096C61O4MLT&keywords=bags&qid=1692733982&sprefix=ba%2Caps%2C283&sr=8-70,TAGUDA Travel Foldable Portable Lightweight Luggage Storage Duffle Tote Hand Organizer Easy Carry Bags Backpack Set for Men Women Travel Luggage (Mint Green Travel Bag),299,3.4,0
https://www.amazon.in/Bagneeds-Synthetic-Leather-Briefcase-Messenger/dp/B0855F8174/ref=mp_s_a_1_71?crid=2M096C61O4MLT&keywords=bags&qid=1692734001&sprefix=ba%2Caps%2C283&sr=8-71,Bagneeds Men's Black Synthetic Leather Briefcase Best Laptop Messenger Bag Satchel for Men,699,4.1,0
https://www.amazon.in/Tabelito%C2%AE-Delta-Waterproof-Backpack-Compatible/dp/B0BLK2RL23/ref=mp_s_a_1_72?crid=2M096C61O4MLT&keywords=bags&qid=1692734001&sprefix=ba%2Caps%2C283&sr=8-72,"Tabelito® DELTA Casual Waterproof Laptop Backpack/Office Bag/School Bag/College Bag/Business Bag/Unisex Travel Backpack (Compatible with 15.6 inch Laptop) 30 L, (6 Month Warranty)",599,4.2,0
https://www.amazon.in/Safari-Sheild-Resistant-Casual-Backpack/dp/B09B26T7KQ/ref=mp_s_a_1_73?crid=2M096C61O4MLT&keywords=bags&qid=1692734001&sprefix=ba%2Caps%2C283&sr=8-73,Safari Sheild 26 Ltrs Water Resistant Casual Backpack - (SHEILD19CBBLK),709,3.9,0
https://www.amazon.in/HYDER-Unisex-Multi-functional-Laptop-Backpack/dp/B0CCKXQNXJ/ref=mp_s_a_1_74?crid=2M096C61O4MLT&keywords=bags&qid=1692734001&sprefix=ba%2Caps%2C283&sr=8-74,"HYDER Peak Black 35L Unisex Multi-functional Laptop Bag/Backpack for Men and Women - Perfect Bags for College, School, and Business Travel with Padded Sleeve For Laptops Protection",780,N/A,0
https://www.amazon.in/Skybags-Unisex-Polyester-Pattern-Hustle/dp/B07F342RQD/ref=mp_s_a_1_75?crid=2M096C61O4MLT&keywords=bags&qid=1692734001&sprefix=ba%2Caps%2C283&sr=8-75,"Skybags Unisex Polyester Solid Pattern Hustle Df 55 (Orange, Small)","1,580",4.4,0
https://www.amazon.in/Skybags-Unisex-Adjustable-Polyester-Backpack/dp/B0BJ763F7Y/ref=mp_s_a_1_76?crid=2M096C61O4MLT&keywords=bags&qid=1692734001&sprefix=ba%2Caps%2C283&sr=8-76,Skybags Kick Unisex Adjustable Strap Polyester Laptop Backpack,"1,379",4.0,0
https://www.amazon.in/Wesley-Spartan-Hiking-Raincover-Organiser/dp/B098QFF5TJ/ref=mp_s_a_1_77?crid=2M096C61O4MLT&keywords=bags&qid=1692734001&sprefix=ba%2Caps%2C283&sr=8-77,Wesley Spartan Unisex Travel Hiking Laptop Bag fits Upto 17.3 inch with Raincover and Internal Organiser Backpack Rucksack College Bag,749,4.1,0
https://www.amazon.in/Gear-Black-Laptop-Backpack-LBPASPIRE0104/dp/B075MK4TXP/ref=mp_s_a_1_78?crid=2M096C61O4MLT&keywords=bags&qid=1692734001&sprefix=ba%2Caps%2C283&sr=8-78,Gear Aspire 30L Water Restant Office Laptop Bag/Backpack for Men/Women/(Black),"1,115",4.3,0
https://www.amazon.in/Genie-compartments-Lightweight-Travelling-Purpose-36/dp/B097JHSJTL/ref=mp_s_a_1_79?crid=2M096C61O4MLT&keywords=bags&qid=1692734001&sprefix=ba%2Caps%2C283&sr=8-79,"Genie Lily Laptop Backpack for Women, 3 compartments, Stylish and Trendy College Bags for Girls, Water Resistant and Lightweight Bags for Office and Travelling Purpose.36 litres (19 inch) Black colour","1,004",4.3,0
https://www.amazon.in/BP1501-15-6-inch-Gaming-Laptop-Backpack/dp/B081RLHHCY/ref=mp_s_a_1_80?crid=2M096C61O4MLT&keywords=bags&qid=1692734001&sprefix=ba%2Caps%2C283&sr=8-80,Asus ROG BP1501 39.62 cm (15.6-inch) Gaming Laptop Backpack (Black),"1,299",4.3,0
https://www.amazon.in/FATMUG-Foldable-Luggage-Packing-Storage/dp/B07YFNXC3H/ref=mp_s_a_1_81?crid=2M096C61O4MLT&keywords=bags&qid=1692734001&sprefix=ba%2Caps%2C283&sr=8-81,"FATMUG Polyester Foldable Duffle Travel Bag Luggage For Travel, Packing And Storage - Men And Women - (60 L, Black)","1,099",4.2,0
https://www.amazon.in/Half-Moon-Trekking-Bags-Compartment/dp/B08PSX1LN9/ref=mp_s_a_1_82?crid=2M096C61O4MLT&keywords=bags&qid=1692734001&sprefix=ba%2Caps%2C283&sr=8-82,Half Moon 45L Hammer Waterproof Laptop Travelling Rucksack Trekking Backpack for Travel Journey bags for Men Women Boys & Girls with 17.3inch Laptop Compartment & Rain cover,"1,349",4.1,0
https://www.amazon.in/Shalimar-Capacity-Travel-Storage-Duffel/dp/B09TPHFMX7/ref=mp_s_a_1_83?crid=2M096C61O4MLT&keywords=bags&qid=1692734001&sprefix=ba%2Caps%2C283&sr=8-83,"SHALIMAR large capacity Travel bag / Storage bag / Move-in bags/ Duffel Bag - Strong, Durable , Foldable and Water Resistant ( Pack of 1 ) ( Blue )",305,4.1,0
https://www.amazon.in/ADISA-laptop-backpack-office-college/dp/B0BXQD8DZX/ref=mp_s_a_1_84?crid=2M096C61O4MLT&keywords=bags&qid=1692734001&sprefix=ba%2Caps%2C283&sr=8-84,ADISA Large laptop backpack office bag college travel back pack with USB,499,3.8,0
https://www.amazon.in/Safari-Backpack-Resistant-Polyester-Travelling/dp/B09B26VHXV/ref=mp_s_a_1_85?crid=2M096C61O4MLT&keywords=bags&qid=1692734025&sprefix=ba%2Caps%2C283&sr=8-85,"Safari Flash Casual Backpack, 26 ltr Water Resistant Travel Bags| Weight Polyester Bagpack for Men and Women, Spacious Shoulder Bag for College, Office, Travelling and Camping",809,3.8,0
https://www.amazon.in/Lenovo-Carrying-15-6-Inch-Toploader-GX40Q17229/dp/B075Y6Y9H5/ref=mp_s_a_1_86?crid=2M096C61O4MLT&keywords=bags&qid=1692734025&sprefix=ba%2Caps%2C283&sr=8-86,Lenovo 15.6-inch Casual Laptop Briefcase T210,799,4.2,0
