Product URL,Product Name,Product Price,Rating,Number of Reviews
https://www.amazon.in/Gear-Classic-Leather-Backpack-LBPCLSLTH0519/dp/B07G4JQX2F/ref=mp_s_a_1_87?crid=2M096C61O4MLT&keywords=bags&qid=1692734025&sprefix=ba%2Caps%2C283&sr=8-87,Gear Classic 20L Faux Leather Water Resistant Anti Theft Laptop Bag/Backpack for Men/Women (Navy-Tan),979,4.4,0
https://www.amazon.in/Kleider-Travel-Business-Messenger-Shoulder/dp/B084ZHP97M/ref=mp_s_a_1_88?crid=2M096C61O4MLT&keywords=bags&qid=1692734025&sprefix=ba%2Caps%2C283&sr=8-88,DEIN KLEIDER Men's Nylon Messenger Bag,349,4.0,0
https://www.amazon.in/DZert-School-Polyester-Backpack-White/dp/B07GXYHFCY/ref=mp_s_a_1_89?crid=2M096C61O4MLT&keywords=bags&qid=1692734025&sprefix=ba%2Caps%2C283&sr=8-89,DZert Clasy Laptop Bag College Bag for Boys Girls 21 L Blue White,339,3.8,0
https://www.amazon.in/Boldfit-Travel-Accessories-Purse-Mobile/dp/B0BJZQ3ZR9/ref=mp_s_a_1_90?crid=2M096C61O4MLT&keywords=bags&qid=1692734025&sprefix=ba%2Caps%2C283&sr=8-90,Boldfit Waist Bag for Men Fanny Pack for Women Fanny Pack for Men Waist Bag for Women Chest Bag for Women Waist Pouch for Men Waist Bag for Boys Waist Bags for Girls Fanny Bag - Black,299,4.2,0
https://www.amazon.in/ADISA-BP004-Weight-Casual-Backpack/dp/B07G3CG9FC/ref=mp_s_a_1_91?crid=2M096C61O4MLT&keywords=bags&qid=1692734025&sprefix=ba%2Caps%2C283&sr=8-91,ADISA Laptop Backpack 31 Ltrs,399,4.0,0
https://www.amazon.in/Dyazo-Resistant-Crossbody-Compatible-Mirrorless/dp/B0C94C8CCQ/ref=mp_s_a_1_92?crid=2M096C61O4MLT&keywords=bags&qid=1692734025&sprefix=ba%2Caps%2C283&sr=8-92,Dyazo Light Weight Water Resistant Single Shoulder Crossbody Camera Bag/Case Compatible for Sony Canon Nikon SLR DSLR Mirrorless Cameras and Lenses (Black & Grey),599,4.3,0
https://www.amazon.in/WILDHORN-Backpack-Compartment-Business-Stitching/dp/B09QL81ZHB/ref=mp_s_a_1_93?crid=2M096C61O4MLT&keywords=bags&qid=1692734025&sprefix=ba%2Caps%2C283&sr=8-93,"WILDHORN 31L Laptop Backpack for Men/Women I Fits upto 15.6"" Laptop I Waterproof I Travel/Business/College Bookbags",599,4.1,0
https://www.amazon.in/Gear-Vintage2-Leather-Backpack-LBPVG2LTH1901/dp/B07G4F3758/ref=mp_s_a_1_94?crid=2M096C61O4MLT&keywords=bags&qid=1692734025&sprefix=ba%2Caps%2C283&sr=8-94,Gear Vintage2 Anti Theft Faux Leather 18 cms Tan Laptop Backpack,979,4.3,0
https://www.amazon.in/Fur-Jaden-Camping-Rucksack-Backpack/dp/B07PMWMN19/ref=mp_s_a_1_95?crid=2M096C61O4MLT&keywords=bags&qid=1692734025&sprefix=ba%2Caps%2C283&sr=8-95,Fur Jaden Hiking Camping Rucksack Casual 10 Ltrs Blue Casual Backpack,249,3.6,0
https://www.amazon.in/Resistant-Photography-Accessories-Compatible-Panasonic/dp/B0BRJLWQ6R/ref=mp_s_a_1_96?crid=2M096C61O4MLT&keywords=bags&qid=1692734025&sprefix=ba%2Caps%2C283&sr=8-96,"Dyazo Water Resistant Camera Bag/Case Shoulder Strap Space for Photography Lens and Accessories Compatible for Nikon, Canon, Sony, Panasonic, Samsung & Other SLR/DSLR etc (Black & Silver)",799,4.3,0
https://www.amazon.in/Tabelito-NEXA-Backpack-Business-Compartment/dp/B0C2D3YR7T/ref=mp_s_a_1_97?crid=2M096C61O4MLT&keywords=bags&qid=1692734025&sprefix=ba%2Caps%2C283&sr=8-97,"Tabelito® NEXA 3O L Water Resistant Laptop/College/Office/School/Travel/Business Bag, Unisex Backpack for Men Women Fits Up to 15.6 Inch Laptop Notebook. (GREY)",399,4.2,0
https://www.amazon.in/ADISA-BP010-Weight-Casual-Backpack/dp/B07MXL986B/ref=mp_s_a_1_98?crid=2M096C61O4MLT&keywords=bags&qid=1692734025&sprefix=ba%2Caps%2C283&sr=8-98,ADISA 32 Ltrs Water Resistant Casual Travel Bagpack/College Backpack/School Office Bag for Men and Women,499,3.9,0
https://www.amazon.in/Half-Moon-Resistant-Backpack-Compartment/dp/B0BHX7GY16/ref=mp_s_a_1_99?crid=2M096C61O4MLT&keywords=bags&qid=1692734056&sprefix=ba%2Caps%2C283&sr=8-99,Half Moon Large 37L Laptop Bag Backpack for menं Women Boys and Girls Luggage Travel Bags with 17.3 inches Laptop Compartment & Rain Cover,849,3.9,0
https://www.amazon.in/FATMUG-Laptop-Bag-Men-Convertible/dp/B084LF4RT5/ref=mp_s_a_1_100?crid=2M096C61O4MLT&keywords=bags&qid=1692734056&sprefix=ba%2Caps%2C283&sr=8-100,"FATMUG Laptop Bag For Men - Convertible Backpack For Office And Travel (Dark Grey,Oxford Fabric)","1,699",4.4,0
https://www.amazon.in/Glowic-Unisexs-Backpack-College-Students/dp/B0BGX9W69N/ref=mp_s_a_1_101?crid=2M096C61O4MLT&keywords=bags&qid=1692734056&sprefix=ba%2Caps%2C283&sr=8-101,Glowic Unisex's Backpack for Men Women Boys Girls/Office School College Teens & Students (WBAG-64) (Black),"1,039",3.6,0
https://www.amazon.in/FATMUG-Foldable-Luggage-Packing-Storage/dp/B07YFNXC3H/ref=mp_s_a_1_102?crid=2M096C61O4MLT&keywords=bags&qid=1692734056&sprefix=ba%2Caps%2C283&sr=8-102,"FATMUG Polyester Foldable Duffle Travel Bag Luggage For Travel, Packing And Storage - Men And Women - (60 L, Black)","1,099",4.2,0
https://www.amazon.in/Nivia-Pulse-Junior-Bag-Aqua-Green/dp/B08D7QNYZX/ref=mp_s_a_1_103?crid=2M096C61O4MLT&keywords=bags&qid=1692734056&sprefix=ba%2Caps%2C283&sr=8-103,"Nivia 5227 Pulse Junior Bag, Others (Orange) (Aqua/Green)",294,3.7,0
https://www.amazon.in/ZOUK-Handmade-Leather-Handles-Multicolor/dp/B09QRYDXJH/ref=mp_s_a_1_104?crid=2M096C61O4MLT&keywords=bags&qid=1692734056&sprefix=ba%2Caps%2C283&sr=8-104,ZOUK Women Laptop Bag Royal Indian Peacock Motif,"1,698",4.4,0
https://www.amazon.in/Amazon-Basics-Laptop-Backpack-Repellent/dp/B09W43XLBY/ref=mp_s_a_1_105?crid=2M096C61O4MLT&keywords=bags&qid=1692734056&sprefix=ba%2Caps%2C283&sr=8-105,"Amazon Basics Water Repellent and Wear Resistant Laptop Backpack - 24L, Blue",649,4.2,0
https://www.amazon.in/Isle-Locada-Hidesign-Womens-Purple/dp/B07T97R1H1/ref=mp_s_a_1_106?crid=2M096C61O4MLT&keywords=bags&qid=1692734056&sprefix=ba%2Caps%2C283&sr=8-106,Isle Locada by Hidesign Women's SLING BAG(AUBERGINE/AUBERG),"1,929",4.5,0
https://www.amazon.in/Safari-Sheild-Resistant-Casual-Backpack/dp/B09B28M2RN/ref=mp_s_a_1_107?crid=2M096C61O4MLT&keywords=bags&qid=1692734056&sprefix=ba%2Caps%2C283&sr=8-107,Safari Sheild 26 Ltrs Water Resistant Casual Backpack - (SHEILD19CBBLK),709,4.0,0
https://www.amazon.in/Skybags-Unisex-Grey-Jacqard-Laptop/dp/B09ZV9SLBJ/ref=mp_s_a_1_108?crid=2M096C61O4MLT&keywords=bags&qid=1692734056&sprefix=ba%2Caps%2C283&sr=8-108,Skybags Unisex Grey Jacqard 34L Laptop Bags,"1,248",4.1,0
https://www.amazon.in/Wesley-Milestone-Waterproof-Backpack-Business/dp/B07NJRPJ6Q/ref=mp_s_a_1_109?crid=2M096C61O4MLT&keywords=bags&qid=1692734056&sprefix=ba%2Caps%2C283&sr=8-109,Wesley Milestone 15.6 inch 25 L Casual Waterproof Laptop Backpack/Office Bag/School Bag/College Bag/Business Bag/Unisex Travel Backpack (Black),448,4.3,0
https://www.amazon.in/Safari-Polyester-Cms-Travel-KRYPTON17DFBLK_Black/dp/B097L3XJ38/ref=mp_s_a_1_110?crid=2M096C61O4MLT&keywords=bags&qid=1692734056&sprefix=ba%2Caps%2C283&sr=8-110,Safari Polyester 24 Cms Travel Bag(KRYPTON17DFBLK_Black),575,4.0,0
https://www.amazon.in/Lavie-Womens-Ushawu-Satchel-Handbag/dp/B0B3J9J9CK/ref=mp_s_a_1_111?crid=2M096C61O4MLT&keywords=bags&qid=1692734056&sprefix=ba%2Caps%2C283&sr=8-111,Lavie Women's Ushawu Satchel Bag | Ladies Purse Handbag,"1,099",4.1,0
https://www.amazon.in/HP-Lightweight-200-Green-Backpack/dp/B08CY1XYFL/ref=mp_s_a_1_112?crid=2M096C61O4MLT&keywords=bags&qid=1692734056&sprefix=ba%2Caps%2C283&sr=8-112,"HP Lightweight 200 15.6-inch Laptop Backpack with Padded Shoulder Straps, Green","1,499",4.3,0
https://www.amazon.in/NORTH-ZONE-Northzone-Business-Messenger/dp/B0C555LQF4/ref=mp_s_a_1_113?crid=2M096C61O4MLT&keywords=bags&qid=1692734097&sprefix=ba%2Caps%2C283&sr=8-113,NORTH ZONE Northzone Sling Cross Body Travel Office Business Messenger One Side Shoulder Pouch Bag Money Bag for Men and Women,249,3.8,0
https://www.amazon.in/House-Quirk-Flamingo-Portable-Different/dp/B09WJ1N2F2/ref=mp_s_a_1_114?crid=2M096C61O4MLT&keywords=bags&qid=1692734097&sprefix=ba%2Caps%2C283&sr=8-114,"House of Quirk Flamingo Makeup Bag Set for Women Portable 3 Different Sizes Toiletry Bag for Travel Daily Use for Women Girl (Flamingo Dark Blue, Set of 3)",389,4.1,0
https://www.amazon.in/American-Tourister-Casual-Travel-Duffle/dp/B00FRCNRPQ/ref=mp_s_a_1_115?crid=2M096C61O4MLT&keywords=bags&qid=1692734097&sprefix=ba%2Caps%2C283&sr=8-115,American Tourister X - Bag Nylon 55 Cms Travel Duffle Bag (Black),"1,899",4.3,0
https://www.amazon.in/Skybags-FUSE-BACKPACK-DEEP-WATER/dp/B0B3XYWY79/ref=mp_s_a_1_116?crid=2M096C61O4MLT&keywords=bags&qid=1692734097&sprefix=ba%2Caps%2C283&sr=8-116,Skybags FUSE BACKPACK MAGNET,809,3.8,0
https://www.amazon.in/DAHSHA-Sling-Messenger-Bag-Grey/dp/B09CGDFNBV/ref=mp_s_a_1_117?crid=2M096C61O4MLT&keywords=bags&qid=1692734097&sprefix=ba%2Caps%2C283&sr=8-117,"DAHSHA Nylon Stylish Small 6 Multi-Pocket Zip Closure Sling Cross Body Travel Messenger One Side Shoulder Bag for Men & Women (Grey, 25 x 10 x 20 CM)",545,4.0,0
https://www.amazon.in/ASUS-Backpack-Cross-Dyed-Material-Suitable/dp/B09Q68446F/ref=mp_s_a_1_118?crid=2M096C61O4MLT&keywords=bags&qid=1692734097&sprefix=ba%2Caps%2C283&sr=8-118,"ASUS BP4600 Laptop Backpack (Grey), with Cross-dyed Woven Fabric Material, Suitable for up to 40.64 cm (16-inch) Laptop","1,199",4.4,0
https://www.amazon.in/Half-Moon-Resistant-Backpack-Compartment/dp/B0BHX7GY16/ref=mp_s_a_1_119?crid=2M096C61O4MLT&keywords=bags&qid=1692734097&sprefix=ba%2Caps%2C283&sr=8-119,Half Moon Large 37L Laptop Bag Backpack for menं Women Boys and Girls Luggage Travel Bags with 17.3 inches Laptop Compartment & Rain Cover,849,3.9,0
https://www.amazon.in/Mammon-Womens-Handbag-plain-tan-35x35/dp/B07LBC7Z59/ref=mp_s_a_1_120?crid=2M096C61O4MLT&keywords=bags&qid=1692734097&sprefix=ba%2Caps%2C283&sr=8-120,Mammon Women's Tote Bag,264,3.6,0
https://www.amazon.in/Gear-Green-Casual-Backpack-BKPECOBP40503/dp/B019HA8DQQ/ref=mp_s_a_1_121?crid=2M096C61O4MLT&keywords=bags&qid=1692734097&sprefix=ba%2Caps%2C283&sr=8-121,Gear Eco4 18L Water Resistant School Bag//Backpack/College Bag for Men/Women - Navy Blue,439,4.0,0
https://www.amazon.in/HP-15-6-inch-Backpack-Pass-Through-793A7AA/dp/B0BYDWD4VL/ref=mp_s_a_1_122?crid=2M096C61O4MLT&keywords=bags&qid=1692734097&sprefix=ba%2Caps%2C283&sr=8-122,HP 330 15.6-inch Laptop Backpack/Trolley Pass-Through; Padded Back Panel; Padded air mesh Panel/Hand wash and air Dry/1 Year Limited Warranty (793A7AA),"1,141",4.6,0
https://www.amazon.in/Chic-Buddy-Waterproof-Swimsuits-Toiletries/dp/B09KSBHC18/ref=mp_s_a_1_123?crid=2M096C61O4MLT&keywords=bags&qid=1692734097&sprefix=ba%2Caps%2C283&sr=8-123,"Chic Buddy Waterproof Wet Bag, Washable, Reusable for Travel, Beach, Pool, Stroller, Diapers, Dirty Gym Clothes, Wet Swimsuits, Toiletries",309,4.4,0
https://www.amazon.in/Tabelito-NEXA-Backpack-Business-Compartment/dp/B0C2D4KWQ6/ref=mp_s_a_1_124?crid=2M096C61O4MLT&keywords=bags&qid=1692734097&sprefix=ba%2Caps%2C283&sr=8-124,"Tabelito® NEXA 3O L Water Resistant Laptop/College/Office/School/Travel/Business Bag, Unisex Backpack for Men Women Fits Up to 15.6 Inch Laptop Notebook. (GREY)",399,4.2,0
https://www.amazon.in/Frantic-Travelling-Backpacks-Preschool-FullBody_SkyElehpant/dp/B0BD5JQX7T/ref=mp_s_a_1_125?crid=2M096C61O4MLT&keywords=bags&qid=1692734097&sprefix=ba%2Caps%2C283&sr=8-125,"Frantic Kids Soft Cartoon Animal Travelling School Bag Soft Plush Backpacks Boys Girls Baby for 2 to 5 Years Baby/Boys/Girls Nursery, Preschool, Picnic(FullBody_SkyElehpant)",309,3.5,0
https://www.amazon.in/Safari-Laptop-Backpack-Compartments-Resistant/dp/B09B27GN41/ref=mp_s_a_1_126?crid=2M096C61O4MLT&keywords=bags&qid=1692734097&sprefix=ba%2Caps%2C283&sr=8-126,"Safari Snap 35 Ltrs Large Laptop Backpack With 3 Compartments, Water Resistant Fabric - Blue (SNAP19CBBLU)","1,109",3.8,0
https://www.amazon.in/HYDER-Superhero-Lightweight-Spacious-Waterproof/dp/B0BJ6CTJ3Q/ref=mp_s_a_1_127?crid=2M096C61O4MLT&keywords=bags&qid=1692734127&sprefix=ba%2Caps%2C283&sr=8-127,HYDER Kids 20L Cartoon Printed Best Stylish Lightweight Spacious Waterproof Casual/Picnic/Tuition/School Bag/Backpack for Children Boys And Girls,499,3.9,0
https://www.amazon.in/DIVULGE-Drawstring-Bag-Sports-Utility/dp/B07PXTDBH4/ref=mp_s_a_1_128?crid=2M096C61O4MLT&keywords=bags&qid=1692734127&sprefix=ba%2Caps%2C283&sr=8-128,"DIVULGE Multi Utility Drawstring Bag (Black , 16 L)",145,4.0,0
https://www.amazon.in/Lavie-Womens-Ushawu-Satchel-Handbag/dp/B0B3J9J9CK/ref=mp_s_a_1_129?crid=2M096C61O4MLT&keywords=bags&qid=1692734127&sprefix=ba%2Caps%2C283&sr=8-129,Lavie Women's Ushawu Satchel Bag | Ladies Purse Handbag,"1,099",4.1,0
https://www.amazon.in/BP1501-15-6-inch-Gaming-Laptop-Backpack/dp/B081RLHHCY/ref=mp_s_a_1_130?crid=2M096C61O4MLT&keywords=bags&qid=1692734127&sprefix=ba%2Caps%2C283&sr=8-130,Asus ROG BP1501 39.62 cm (15.6-inch) Gaming Laptop Backpack (Black),"1,299",4.3,0
https://www.amazon.in/TRUE-HUMAN-Anti-Theft-charging-combination/dp/B09H7PK5ML/ref=mp_s_a_1_131?crid=2M096C61O4MLT&keywords=bags&qid=1692734127&sprefix=ba%2Caps%2C283&sr=8-131,TRUE HUMAN Anti-Theft and USB charging port backpack with security lock Laptop bag|office bag| for men and women (Grey),649,3.8,0
https://www.amazon.in/Kuber-Industries-Avengers-Backpacks-Waterproof/dp/B0BP7JFYDV/ref=mp_s_a_1_132?crid=2M096C61O4MLT&keywords=bags&qid=1692734127&sprefix=ba%2Caps%2C283&sr=8-132,Kuber Industries Marvel Avengers School Bag for Kids|Stylish Backpacks for Kids|Rexine Waterproof Shoulder Straps Bag (Blue),664,3.9,0
https://www.amazon.in/Wesley-Liter-Casual-Daypack-Backpack/dp/B0BVVY98PZ/ref=mp_s_a_1_133?crid=2M096C61O4MLT&keywords=bags&qid=1692734127&sprefix=ba%2Caps%2C283&sr=8-133,Wesley 15 Liter Casual Daypack Backpack,169,3.7,0
https://www.amazon.in/STRABO-Cooper-Laptop-Bag-Capacity/dp/B0BX9V66C9/ref=mp_s_a_1_134?crid=2M096C61O4MLT&keywords=bags&qid=1692734127&sprefix=ba%2Caps%2C283&sr=8-134,"STRABO Cooper for Boys Girls Stylish Men and Women Casual 15"" inch 25L CANVAS Laptop BACKPACK | Office, College, Travel Bag",699,4.3,0
https://www.amazon.in/Uppercase-Professional-Backpack-Resistant-Sustainable/dp/B0BWNBQXDZ/ref=mp_s_a_1_135?crid=2M096C61O4MLT&keywords=bags&qid=1692734127&sprefix=ba%2Caps%2C283&sr=8-135,"uppercase Apex Professional Laptop Backpack (15.6 Inch) 3x more water resistant sustainable bags with rain proof zippers for Men, Women, Boys and Girls, 750 Days warranty","1,800",4.4,0
https://www.amazon.in/Frantic-Velvet-School-Nursery-Travelling/dp/B09176PYDR/ref=mp_s_a_1_136?crid=2M096C61O4MLT&keywords=bags&qid=1692734127&sprefix=ba%2Caps%2C283&sr=8-136,Frantic Velvet Kids School/Nursery/Picnic/Carry/Travelling Bag - 2 to 5 Year Age,299,3.8,0
https://www.amazon.in/Gear-Executive-Anti-Theft-Backpack-BKPPKREXE0101/dp/B097KCMQKG/ref=mp_s_a_1_137?crid=2M096C61O4MLT&keywords=bags&qid=1692734127&sprefix=ba%2Caps%2C283&sr=8-137,Gear Parker 23L Water Resistant Anti Theft Laptop Bag/Backpack for Men/Women - Black,744,4.3,0
https://www.amazon.in/Skybags-Unisex-Adjustable-Polyester-Backpack/dp/B0BJ763F7Y/ref=mp_s_a_1_138?crid=2M096C61O4MLT&keywords=bags&qid=1692734127&sprefix=ba%2Caps%2C283&sr=8-138,Skybags Kick Unisex Adjustable Strap Polyester Laptop Backpack,"1,379",4.0,0
https://www.amazon.in/F-Gear-Spartan-Black-Laptop-Backpack/dp/B07X82WYGL/ref=mp_s_a_1_139?crid=2M096C61O4MLT&keywords=bags&qid=1692734127&sprefix=ba%2Caps%2C283&sr=8-139,F Gear Spartan 24 Ltrs Black Laptop Backpack (3179),623,4.0,0
https://www.amazon.in/Safari-Black-Casual-Backpack-PRISMA19CBBLK/dp/B07HN5TMQL/ref=mp_s_a_1_140?crid=2M096C61O4MLT&keywords=bags&qid=1692734127&sprefix=ba%2Caps%2C283&sr=8-140,Safari Large Size 32 Ltrs Casual Backpack-Black,"1,009",4.0,0
https://www.amazon.in/Hammonds-Flycatcher-Genuine-Leather-Messenger/dp/B07MDTVDQH/ref=mp_s_a_1_127?crid=2M096C61O4MLT&keywords=bags&qid=1692734133&sprefix=ba%2Caps%2C283&sr=8-127,"HAMMONDS FLYCATCHER Genuine Leather Laptop Bag for Men/Office Bag for Men, Brown |Fits Upto 14 Inch Laptop Bag/MacBook |Leather Bag for Men with Shoulder Straps |Crossbody Laptop Messenger Bag for Men","2,417",4.4,0
https://www.amazon.in/Number-Backpack-Compartment-Charging-Organizer/dp/B09VTCNN75/ref=mp_s_a_1_128?crid=2M096C61O4MLT&keywords=bags&qid=1692734133&sprefix=ba%2Caps%2C283&sr=8-128,"FUR JADEN Anti Theft Number Lock Backpack Bag with 15.6 Inch Laptop Compartment, USB Charging Port & Organizer Pocket for Men Women Boys Girls",679,4.0,0
https://www.amazon.in/WildHorn-Leather-Laptop-Messenger-Dimension/dp/B079HQKSZN/ref=mp_s_a_1_129?crid=2M096C61O4MLT&keywords=bags&qid=1692734133&sprefix=ba%2Caps%2C283&sr=8-129,WildHorn Leather Laptop Bag for Men I Fits Upto 15.6 Inch Laptop/MacBook I Padded Laptop Compartment I Carry Handles with Adjustable Strap I DIMENSION : L-16 inch W-4 inch H-12 inch,"2,629",4.2,0
https://www.amazon.in/ADISA-Laptop-Backpack-College-z-Black/dp/B09TPY1G1W/ref=mp_s_a_1_130?crid=2M096C61O4MLT&keywords=bags&qid=1692734133&sprefix=ba%2Caps%2C283&sr=8-130,ADISA 15.6 inch laptop backpack office bag college travel back pack 32 Ltrs,499,3.9,0
https://www.amazon.in/Lavie-Womens-Ushawu-Satchel-Handbag/dp/B0B3J9J9CK/ref=mp_s_a_1_131?crid=2M096C61O4MLT&keywords=bags&qid=1692734133&sprefix=ba%2Caps%2C283&sr=8-131,Lavie Women's Ushawu Satchel Bag | Ladies Purse Handbag,"1,099",4.1,0
https://www.amazon.in/Boldfit-Travel-Accessories-Purse-Mobile/dp/B0BJZQ3ZR9/ref=mp_s_a_1_132?crid=2M096C61O4MLT&keywords=bags&qid=1692734133&sprefix=ba%2Caps%2C283&sr=8-132,Boldfit Waist Bag for Men Fanny Pack for Women Fanny Pack for Men Waist Bag for Women Chest Bag for Women Waist Pouch for Men Waist Bag for Boys Waist Bags for Girls Fanny Bag - Black,299,4.2,0
https://www.amazon.in/Glowic-Unisexs-Backpack-College-Students/dp/B0BGX9W69N/ref=mp_s_a_1_133?crid=2M096C61O4MLT&keywords=bags&qid=1692734133&sprefix=ba%2Caps%2C283&sr=8-133,Glowic Unisex's Backpack for Men Women Boys Girls/Office School College Teens & Students (WBAG-64) (Black),"1,039",3.6,0
https://www.amazon.in/HP-15-6-inch-Backpacks-Pass-Through-793A6AA/dp/B0BYDXVM5Q/ref=mp_s_a_1_134?crid=2M096C61O4MLT&keywords=bags&qid=1692734133&sprefix=ba%2Caps%2C283&sr=8-134,HP 320 15.6-inch Backpacks/Trolley Pass-Through; Padded Back Panel; Padded air mesh Panel/Hand wash and air Dry/Padded Laptop Pocket/1 Year Limited Warranty (793A6AA),"1,049",3.9,0
https://www.amazon.in/ZOUK-Printed-Handmade-Leather-handles/dp/B07NHYLTY7/ref=mp_s_a_1_135?crid=2M096C61O4MLT&keywords=bags&qid=1692734133&sprefix=ba%2Caps%2C283&sr=8-135,ZOUK Black Floral Printed Handmade Vegan Leather Women's Office Bag for 15.6 inch Laptop with double handles - FloMotif,"1,599",4.3,0
https://www.amazon.in/Amazon-Basics-Laptop-Backpack-Repellent/dp/B09W43XLBY/ref=mp_s_a_1_136?crid=2M096C61O4MLT&keywords=bags&qid=1692734133&sprefix=ba%2Caps%2C283&sr=8-136,"Amazon Basics Water Repellent and Wear Resistant Laptop Backpack - 24L, Blue",649,4.2,0
https://www.amazon.in/Wildcraft-Music-Backpack-Green-11954/dp/B07N2SBX54/ref=mp_s_a_1_137_mod_primary_new?crid=2M096C61O4MLT&keywords=bags&qid=1692734133&sbo=RZvfv%2F%2FHxDF%2BO5021pAnSA%3D%3D&sprefix=ba%2Caps%2C283&sr=8-137,Wildcraft Unisex Zip Closure Backpack (Green_Free Size),"1,199",4.4,0
https://www.amazon.in/DZert-Kids-Grey-School-Years/dp/B07QD1M3R9/ref=mp_s_a_1_138?crid=2M096C61O4MLT&keywords=bags&qid=1692734133&sprefix=ba%2Caps%2C283&sr=8-138,DZert Kids School Bag Soft Plush Backpacks Cartoon Boys Girls Baby (2-5 Years),200,3.7,0
https://www.amazon.in/Gear-Vintage2-Leather-Backpack-LBPVG2LTH0101/dp/B07G44G1DC/ref=mp_s_a_1_139?crid=2M096C61O4MLT&keywords=bags&qid=1692734133&sprefix=ba%2Caps%2C283&sr=8-139,Gear Vintage2 28L Medium Faux Leather Water Resistant Anti Theft Unisex Laptop Backpack for Men/Women- Black,979,4.4,0
https://www.amazon.in/Tabelito%C2%AE-Delta-Waterproof-Backpack-Compatible/dp/B0BLK1Z7DQ/ref=mp_s_a_1_140?crid=2M096C61O4MLT&keywords=bags&qid=1692734133&sprefix=ba%2Caps%2C283&sr=8-140,"Tabelito® DELTA Casual Waterproof Laptop Backpack/Office Bag/School Bag/College Bag/Business Bag/Unisex Travel Backpack (Compatible with 15.6 inch Laptop) 30 L, (6 Month Warranty)",599,4.4,0
https://www.amazon.in/Harissons-Office-Laptop-Backpacks-Women/dp/B09D3YYYNG/ref=mp_s_a_1_155?crid=2M096C61O4MLT&keywords=bags&qid=1692734158&sprefix=ba%2Caps%2C283&sr=8-155,HARISSONS Bags Volt 15.6 inch Office Laptop Backpacks for Men and Women 24 Ltrs with 2 Front Zippered Pockets & Spacious Large Compartments | External USB Gate for easy Charging,"1,504",4.1,0
https://www.amazon.in/ADISA-Laptop-Backpack-Office-College/dp/B0BPVLXD53/ref=mp_s_a_1_156?crid=2M096C61O4MLT&keywords=bags&qid=1692734158&sprefix=ba%2Caps%2C283&sr=8-156,ADISA 32L large laptop backpack office bag college travel back pack with rain cover,599,3.9,0
https://www.amazon.in/ASTRID-Blue-Diamond-Textured-Cotton/dp/B08W5DQ33D/ref=mp_s_a_1_157?crid=2M096C61O4MLT&keywords=bags&qid=1692734158&sprefix=ba%2Caps%2C283&sr=8-157,ASTRID Blue Diamond Textured Cotton Tote Bag,589,4.4,0
https://www.amazon.in/Skybags-Unisex-Grey-Jacqard-Laptop/dp/B09ZV9SLBJ/ref=mp_s_a_1_158?crid=2M096C61O4MLT&keywords=bags&qid=1692734158&sprefix=ba%2Caps%2C283&sr=8-158,Skybags Unisex Grey Jacqard 34L Laptop Bags,"1,248",4.1,0
https://www.amazon.in/ADISA-Laptop-Backpack-Office-College/dp/B0BPVCBFM7/ref=mp_s_a_1_159?crid=2M096C61O4MLT&keywords=bags&qid=1692734158&sprefix=ba%2Caps%2C283&sr=8-159,ADISA 32L large laptop backpack office bag college travel back pack with rain cover,599,3.9,0
https://www.amazon.in/Gear-Green-Casual-Backpack-BKPECOBP40503/dp/B019HA8DQQ/ref=mp_s_a_1_160?crid=2M096C61O4MLT&keywords=bags&qid=1692734158&sprefix=ba%2Caps%2C283&sr=8-160,Gear Eco4 18L Water Resistant School Bag//Backpack/College Bag for Men/Women - Navy Blue,439,4.0,0
https://www.amazon.in/House-Quirk-Flamingo-Portable-Different/dp/B09WJ1N2F2/ref=mp_s_a_1_161?crid=2M096C61O4MLT&keywords=bags&qid=1692734158&sprefix=ba%2Caps%2C283&sr=8-161,"House of Quirk Flamingo Makeup Bag Set for Women Portable 3 Different Sizes Toiletry Bag for Travel Daily Use for Women Girl (Flamingo Dark Blue, Set of 3)",389,4.1,0
https://www.amazon.in/American-Tourister-Casual-Travel-Duffle/dp/B00FRCNRPQ/ref=mp_s_a_1_162?crid=2M096C61O4MLT&keywords=bags&qid=1692734158&sprefix=ba%2Caps%2C283&sr=8-162,American Tourister X - Bag Nylon 55 Cms Travel Duffle Bag (Black),"1,899",4.3,0
https://www.amazon.in/Frantic-Travelling-Backpacks-Preschool-FullBody_SkyElehpant/dp/B0BD5JQX7T/ref=mp_s_a_1_163?crid=2M096C61O4MLT&keywords=bags&qid=1692734158&sprefix=ba%2Caps%2C283&sr=8-163,"Frantic Kids Soft Cartoon Animal Travelling School Bag Soft Plush Backpacks Boys Girls Baby for 2 to 5 Years Baby/Boys/Girls Nursery, Preschool, Picnic(FullBody_SkyElehpant)",309,3.5,0
https://www.amazon.in/Safari-Polyester-Cms-Travel-KRYPTON17DFBLK_Black/dp/B097L3XJ38/ref=mp_s_a_1_164?crid=2M096C61O4MLT&keywords=bags&qid=1692734158&sprefix=ba%2Caps%2C283&sr=8-164,Safari Polyester 24 Cms Travel Bag(KRYPTON17DFBLK_Black),575,4.0,0
https://www.amazon.in/ASUS-Backpack-Cross-Dyed-Material-Suitable/dp/B09Q68446F/ref=mp_s_a_1_165?crid=2M096C61O4MLT&keywords=bags&qid=1692734158&sprefix=ba%2Caps%2C283&sr=8-165,"ASUS BP4600 Laptop Backpack (Grey), with Cross-dyed Woven Fabric Material, Suitable for up to 40.64 cm (16-inch) Laptop","1,199",4.4,0
https://www.amazon.in/Half-Moon-Resistant-Backpack-Compartment/dp/B0BHX7GY16/ref=mp_s_a_1_166?crid=2M096C61O4MLT&keywords=bags&qid=1692734158&sprefix=ba%2Caps%2C283&sr=8-166,Half Moon Large 37L Laptop Bag Backpack for menं Women Boys and Girls Luggage Travel Bags with 17.3 inches Laptop Compartment & Rain Cover,849,3.9,0
https://www.amazon.in/Gear-Classic-Leather-Backpack-LBPCLSLTH0519/dp/B07G4JQX2F/ref=mp_s_a_1_167?crid=2M096C61O4MLT&keywords=bags&qid=1692734158&sprefix=ba%2Caps%2C283&sr=8-167,Gear Classic 20L Faux Leather Water Resistant Anti Theft Laptop Bag/Backpack for Men/Women (Navy-Tan),979,4.4,0
https://www.amazon.in/Skybags-Unisex-Gucci-Fabric-Backpacks/dp/B0B21XYWWH/ref=mp_s_a_1_168?crid=2M096C61O4MLT&keywords=bags&qid=1692734158&sprefix=ba%2Caps%2C283&sr=8-168,Skybags Unisex Red Gucci Fabric 10L Backpacks,460,3.8,0
https://www.amazon.in/Skybags-Unisex-Gucci-Fabric-Backpacks/dp/B0B21XYWWH/ref=mp_s_a_1_169?crid=2M096C61O4MLT&keywords=bags&qid=1692734230&sprefix=ba%2Caps%2C283&sr=8-169,Skybags Unisex Red Gucci Fabric 10L Backpacks,460,3.8,0
https://www.amazon.in/ASUS-VP5700-Backpack-Repellent-Suitable/dp/B093HGZMHV/ref=mp_s_a_1_170?crid=2M096C61O4MLT&keywords=bags&qid=1692734230&sprefix=ba%2Caps%2C283&sr=8-170,"ASUS TUF Gaming VP5700 46.14 cm Backpack (Black), with Water Repellent Fabric, Suitable for up to 43.18 cm Laptop","1,199",4.4,0
https://www.amazon.in/BEAUTY-GIRLS-Polyester-Waterproof-Backpack/dp/B08YRFQHQX/ref=mp_s_a_1_171?crid=2M096C61O4MLT&keywords=bags&qid=1692734230&sprefix=ba%2Caps%2C283&sr=8-171,"BEAUTY GIRLS 1531 Polyester Waterproof 30 L Floral Printed School, College Tuition Laptop Backpack Bag for Girls & Women",829,4.3,0
https://www.amazon.in/Gizga-Essentials-Organizer-Multi-Utility-Cosmetics/dp/B09WVRKYCJ/ref=mp_s_a_1_172?crid=2M096C61O4MLT&keywords=bags&qid=1692734230&sprefix=ba%2Caps%2C283&sr=8-172,"Gizga Essentials Travel Toiletry Kit Bag for Men & Women, Travel Organizer Case with Handle & Hook, Premium Zipper, Multiple Pockets, Multi-Utility Pouch for Shaving Makeup Cosmetics, Light Grey",349,4.2,0
https://www.amazon.in/Crossbody-Waterproof-Daypack-Charging-Locomotive/dp/B0BCQ762R6/ref=mp_s_a_1_173?crid=2M096C61O4MLT&keywords=bags&qid=1692734230&sprefix=ba%2Caps%2C283&sr=8-173,HOXSURY Sling Backpack USB Anti-Theft Waterproof Chest Daypack Casual Shoulder Bag,"1,199",4.4,0
https://www.amazon.in/HP-Backpack-Laptop-Chromebook-1D0M5PA/dp/B08FM6X8KZ/ref=mp_s_a_1_174?crid=2M096C61O4MLT&keywords=bags&qid=1692734230&sprefix=ba%2Caps%2C283&sr=8-174,HP 5 ltrs (2 cms)backpack(1D0M5PA_black),"1,499",4.2,0
https://www.amazon.in/Half-Moon-Resistant-Laptop-Backpack/dp/B09842K4RQ/ref=mp_s_a_1_175?crid=2M096C61O4MLT&keywords=bags&qid=1692734230&sprefix=ba%2Caps%2C283&sr=8-175,"Half Moon 35L Water Resistant 15.6 inch Laptop Bag for Men/Backpack for Men, Black | Office Bag for Men/Office Bag for Women with Padded Laptop Compartment | Rain Cover & Reflective Strips",699,3.9,0
